{"$schema":"https://json-schema.org/draft/2020-12/schema","$id":"https://shabilev.github.io/aos/research-progress.schema.json","title":"Research Progress","type":"object","required":["schemaVersion","updatedAt","sources","validated","duplicates","claimsExtracted","claimsVerified","candidatesGenerated","candidatesPendingReview","approvedCandidates","publishedItems","staleItems","rejectedItems","topicCoverage","missingTopicCoverage","latestResearchRun","nextResearchTopics"],"properties":{"schemaVersion":{"type":"string"},"updatedAt":{"type":"string"},"sources":{"type":"integer","minimum":0},"validated":{"type":"integer","minimum":0},"duplicates":{"type":"integer","minimum":0},"claimsExtracted":{"type":"integer","minimum":0},"claimsVerified":{"type":"integer","minimum":0},"candidatesGenerated":{"type":"integer","minimum":0},"candidatesPendingReview":{"type":"integer","minimum":0},"approvedCandidates":{"type":"integer","minimum":0},"publishedItems":{"type":"integer","minimum":0},"staleItems":{"type":"integer","minimum":0},"rejectedItems":{"type":"integer","minimum":0},"topicCoverage":{"type":"array","items":{"type":"string"}},"missingTopicCoverage":{"type":"array","items":{"type":"string"}},"latestResearchRun":{"type":"string"},"nextResearchTopics":{"type":"array","items":{"type":"string"}}}}
